MTUxMzc3NTIwNTQxNjgyMjEyMHB5dGhvbjMxOTk5MQ==.md,python3 unsupported locale error (Wed Dec 20 18:36:45 IST 2017)
MTUxNDAzNDMyMTcwMzY1ODg4MWNoYW5naW5nMTU4MzE=.md,changing owner of all files and directories under pwd (Sat Dec 23 18:35:21 IST 2017)
MTUxNDAzNjk1NDMzNzE2OTk0MXNoZWxsMjYxOTU=.md,shell script for renaming to proper name of file in directory (Sat Dec 23 19:19:14 IST 2017)
MTUxNDAzNzg3MzY0MzgzNTUyM2FkZDIzNzA=.md,add auto suggestions for oh my zsh (Sat Dec 23 19:34:33 IST 2017)
MTUxNDE4MTA2MDQ5NDQ4OTE5M3B5ZHJpdmUyNzE5Ng==.md,pydrive cannot import 'opentype' error (Mon Dec 25 11:21:00 IST 2017)
MTUxNDIyMTg1ODg5NDYyMDI0NHNsaWNpbmcvY29udmVydGluZzg5OTk=.md,slicing/converting string into array bash (Mon Dec 25 22:40:58 IST 2017)
MTUxNDcyNzY3Mjk3Nzc3OTY1OHRlc3Rvc3Rlcm9uZTIyNTI0.md,testosterone boosting suppliments (Sun Dec 31 19:11:12 IST 2017)
MTUxNDc3OTMzMjc1MjMxODIyMWluc3RhbGwzNDUx.md,install oh-my-zsh (Mon Jan 1 09:32:12 IST 2018)
MTUxNDgyNDEyMjAzNTc3NDMwNG5ncm9rMTc0MzI=.md,ngrok zip file (Mon Jan 1 21:58:42 IST 2018)
